A_var,A_org_id,A_descricao,proposed_vcode,B_match_vcode,B_match_desc,C_match_vcode,C_match_desc,v050_present_pop,v050_present_hh,evidence_strength,notes
SCNAOUNI,11.78,Nao vive com conjuge,V0333,V0333,Estado Conjugal (Situação Conjugal),V0333,Estado Conjugal (Situação Conjugal),Y,N,HIGH,"5=Separado n/jud, 6=Desq/sep jud, 7=Divorciado, 8=Viúvo, 9=Ignorado — exatamente as categorias para quem não vive com cônjuge."
SCNATUNI,11.79,Natureza da uniao,V0332,V0332,Estado Conjugal (Natureza da União),V0332,Estado Conjugal (Natureza da União),Y,N,HIGH,"1=Civ+religioso, 2=Só civil, 3=Só religioso, 4=Consensual, 9=Ignorado batem."
SCVIVCON,11.80,Vive ou viveu com conjuge,V0330,V0330,Vive ou Viveu com Cônjuge,V0330,Vive ou Viveu com Cônjuge,Y,N,HIGH,"1=Sim, 2=Não batem."
SEXO,11.81,Sexo,V0301,V0301,Sexo,V0301,Sexo,Y,N,HIGH,"1=Masculino, 2=Feminino."
SITDESO,11.82,Situacao desocupado,V0358,V0358,Condição de Atividade,V0358,Condição de Atividade,Y,N,HIGH,"10 categorias (Sem ocup, Procurando ja-trab, Procurando nunca, Aposentado, Pensionista, Vive Rendas, Detento, Estudante, Doente, Afaz dom) batem."
TRUL12M,11.83,Trabalhou ultimos 12 meses,V0345,V0345,Trabalhou em todos ou em parte dos últimos 12 meses,V0345,Trabalhou em todos ou em parte dos últimos 12 meses,Y,N,HIGH,"1=Habit, 2=Eventual, 3=Não trab batem."
UVIVIDAD,11.84,Idade calculada do ult.filho nasc.vivo,V3443,V3443,Idade Calculada do(a) Último(a) Filho(a) Nascido(a) Vivo(a),V3443,Idade Calculada do(a) Último(a) Filho(a) Nascido(a) Vivo(a),Y,N,HIGH,"Numérico."
UVIVIDTP,11.85,Tipo idade ult.filho nasc vivo,V3444,V3444,Tipo de Idade do(a) Último(a) Filho(a) Nascido(a) Vivo(a),V3444,Tipo de Idade do(a) Último(a) Filho(a) Nascido(a) Vivo(a),Y,N,HIGH,"1=Presumida, 2=Declarada, 9=Ignorada batem."
UVIVSEXO,11.86,Sexo ultimo filho nascido vivo,V0343,V0343,Sexo do Último Filho Nascido Vivo,V0343,Sexo do Último Filho Nascido Vivo,Y,N,HIGH,"1=Homem, 2=Mulher, 7=Não tem, 9=Ignorado batem."
