A_var,A_org_id,A_descricao,proposed_vcode,B_match_vcode,B_match_desc,C_match_vcode,C_match_desc,v050_present_pop,v050_present_hh,evidence_strength,notes
UFNOM,21,Nome da UF,,,,,,N,N,CANNOT_MAP,Nome textual da UF; não há V-code histórico (apenas o código numérico V1101). Variável derivável a partir do code via crosswalk.
UFNUM,22,Codigo da UF,V1101,V1101,Unidade da Federação,V1101,UF,Y,Y,HIGH,3 sources agree.
MESONOM,31,Nome da Mesorregiao,,,,,,N,N,CANNOT_MAP,Nome textual da meso; sem V-code histórico (V7001 é código).
MESONUM,32,Codigo da Mesorregiao,V7001,V7001,Mesorregião,V7001,Mesorregião,Y,Y,HIGH,3 sources agree.
MICRONOM,41,Nome da Microrregiao,,,,,,N,N,CANNOT_MAP,Nome textual da micro; sem V-code histórico.
MICRONUM,42,Codigo da Microrregiao,V7002,V7002,Microrregião,V7002,Microrregião,Y,Y,HIGH,3 sources agree.
MUNICNOM,51,Nome do municipio,,,,,,N,N,CANNOT_MAP,Nome textual do municipio; sem V-code histórico (V1102 é código).
METROP,52,Codigo da area metropolitana,V7003,V7003,Região Metropolitana,V7003,Regiao metropolitana,Y,Y,HIGH,Categorias coincidem (0=Não metro, 1=Belém, ...).
MUNICNUM,53,Codigo do municipio,V1102,V1102,Município,V1102,Município,Y,Y,HIGH,3 sources agree.
SITSET,85,Situacao do Setor,V1061,V1061,Situação do Domicílio,V1061,Situação do Domicílio,Y,Y,HIGH,Categorias 1-8 coincidem.
AGUA,91,Abastecimento de agua,V0205,V0205,Abastecimento de Água,V0205,Abastecimento de Água,Y,Y,HIGH,Categorias 1-6 coincidem (rede/poço/outra com/sem canalização).
ALUGUEFX,92,Faixa de aluguel,V2094,V2094,Faixas de Aluguel Mensal,V2094,Faixas de Aluguel Mensal,Y,Y,HIGH,Categorias 0-9 coincidem.
ALUGUEL,93,Aluguel mensal,V0209,V0209,Aluguel Mensal,V0209,Aluguel Mensal,Y,Y,HIGH,Campo numérico de valor pago.
ASPIRPO,94,Aspirador de po,V0227,V0227,Aspirador de Pó,V0227,Aspirador de Pó,Y,Y,HIGH,3 sources agree.
AUTPART,95,Automovel particular,V0218,V0218,Automóvel Particular,V0218,Automóvel Particular,Y,Y,HIGH,Categorias coincidem.
AUTTRAB,96,Automovel para trabalho,V0219,V0219,Automóvel para Trabalho,V0219,Automóvel para Trabalho,Y,Y,HIGH,Categorias coincidem.
BANHEIRO,97,Numero de Banheiros,V0213,V0213,Banheiros,V0213,Banheiros,Y,Y,HIGH,Categorias 0-5 coincidem.
CD107,98,Numero do domic no CD107,V0109,V0109,Número do Domicílio no CD 1.07,V0109,Número do Domicílio,Y,Y,HIGH,3 sources agree.
COBERTUR,99,Cobertura,V0204,V0204,Cobertura,V0204,Cobertura,Y,Y,HIGH,Categorias 1-8 coincidem.
COMBCOZI,9.10,Combustivel usado p/ cozinhar,V0210,V0210,Combustível Usado para Cozinhar,V0210,Combustível Usado para Cozinhar,Y,Y,HIGH,Categorias 0-6 coincidem.
COMODOR,9.11,Comodos servindo de dormitorio,V0212,V0212,Cômodos Servindo de Dormitório,V0212,Cômodos Servindo de Dormitório,Y,Y,HIGH,3 sources agree.
COMODOS,9.12,Total de comodos,V0211,V0211,Total de Cômodos,V0211,Total de Cômodos,Y,Y,HIGH,3 sources agree.
CONDOCUP,9.13,Condicao de Ocupacao,V0208,V0208,Condição de Ocupação do Domicílio,V0208,Condição de Ocupação do Domicílio,Y,Y,HIGH,Categorias 1-6 coincidem.
DEMOCOFX,9.14,Faixa densid morador/comodo,V2112,V2112,Faixas de Densidade de Moradores por Cômodo,V2112,Faixas de Densidade de Moradores por Cômodo,Y,Y,HIGH,Categorias 1-5 coincidem.
DEMOCOMO,9.15,Densidade morador comodo,V2111,V2111,Densidade de Moradores por Cômodo,V2111,Densidade de Moradores por Cômodo,Y,Y,HIGH,REAL field; 3 sources agree.
DEMODOFX,9.16,Faixa densid morad/dormitorio,V2122,V2122,Faixas de Densidade de Moradores por Dormitório,V2122,Faixas de Densidade de Moradores por Dormitório,Y,Y,HIGH,Categorias 1-7 coincidem.
DEMODORM,9.17,Densidade morador dormitorio,V2121,V2121,Densidade de Moradores por Dormitório,V2121,Densidade de Moradores por Dormitório,Y,Y,HIGH,REAL field; 3 sources agree.
ESPECIE,9.18,Especie do domicilio,V0201,V0201,Espécie do Domicílio,V0201,Espécie do Domicílio,Y,Y,HIGH,Categorias 1-3 coincidem.
FILTRO,9.19,Filtro de agua,V0216,V0216,Filtro de Água,V0216,Filtro de Água,Y,Y,HIGH,3 sources agree.
FREEZER,9.20,Freezer,V0225,V0225,Freezer,V0225,Freezer,Y,Y,HIGH,3 sources agree.
GELADEIR,9.21,Geladeira,V0222,V0222,Geladeira,V0222,Geladeira,Y,Y,HIGH,Categorias 0-2 coincidem.
ILUMINA,9.22,Iluminacao,V0221,V0221,Iluminação,V0221,Iluminação,Y,Y,HIGH,Categorias 1-4 coincidem.
LIXO,9.23,Destino do lixo,V0214,V0214,Destino do Lixo,V0214,Destino do Lixo,Y,Y,HIGH,Categorias 1-7 coincidem.
LOCALIZA,9.24,Localizacao,V0202,V0202,Localização,V0202,Localização,Y,Y,HIGH,Categorias 1-7 coincidem.
MAQLAVAR,9.25,Maquina lavar roupa,V0226,V0226,Máquina de Lavar Roupa,V0226,Máquina de Lavar Roupa,Y,Y,HIGH,3 sources agree.
PAREDES,9.26,Paredes,V0203,V0203,Paredes,V0203,Paredes,Y,Y,HIGH,Categorias 1-6 coincidem.
PESO,9.27,Peso de expansao,V7300,V7300,Peso ou Fator para Expansão da Amostra,V7300,Peso ou Fator para Expansão da Amostra,N,Y,HIGH,Domicilio: V7300; em pessoa seria V7301 mas A descricao é REAL/Peso de expansao alinhado com record de domicilio.
RADIO,9.28,Radio,V0220,V0220,Rádio,V0220,Rádio,Y,Y,HIGH,3 sources agree.
RDOMICIV,9.29,Renda domiciliar,V2012,V2012,Rendimento Nominal Médio Mensal Domiciliar,V2012,Rendimento Nominal Médio Mensal Domiciliar,Y,Y,HIGH,Campo numérico de valor.
RDONOMIF,9.30,Faixa renda dom nominal,V2013,V2013,Faixas de Rendimento Nominal Médio Mensal Domiciliar,V2013,Faixas de Rendimento Nominal Médio Mensal Domiciliar,Y,Y,HIGH,Categorias 1-13 coincidem.
RDOREALF,9.31,Faixa renda dom real,V2014,V2014,Faixas de Rendimento Real Médio Mensal Domiciliar,V2014,Faixas de Rendimento Real Médio Mensal Domiciliar,Y,Y,HIGH,Categorias 1-13 coincidem.
SANESCOA,9.32,Instalacao Sanit. - Escoadouro,V0206,V0206,Instalação Sanitária,V0206,Instalação Sanitária,Y,Y,HIGH,Categorias 0-7 coincidem.
SANUSO,9.33,Inst Sanit - Uso,V0207,V0207,Uso da Instalação Sanitária,V0207,Uso da Instalação Sanitária,Y,Y,HIGH,Categorias 0-2 coincidem.
TELEFONE,9.34,Telefone,V0217,V0217,Telefone,V0217,Telefone,Y,Y,HIGH,Categorias 0-2 coincidem.
TVCORES,9.35,Televisao em cores,V0224,V0224,Televisão em Cores,V0224,Televisão em Cores,Y,Y,HIGH,Categorias 0-3 coincidem.
TVPRETO,9.36,Televisao em preto e branco,V0223,V0223,Televisão Preto e Branco,V0223,Televisão Preto e Branco,Y,Y,HIGH,3 sources agree.
ESPFAM,10.1,Especie de familia,V2011,V2011,Espécie de Família,V2011,Espécie de Família,Y,N,HIGH,Categorias 1-4 coincidem (Nuclear/Estendida/Composta/Unipessoal).
NUMFAM,10.2,Familia a que pertence,V0304,V0304,Tipo de Família,V0304,Tipo de Família,Y,N,HIGH,Categorias 1-7 coincidem.
RFACHCAF,10.3,Faixa renda casal nominal,V3044,V3044,Faixas de Renda do Casal,V3044,Faixas de Renda do Casal,Y,N,HIGH,Categorias 1-15 coincidem.
RFACHCAV,10.4,Renda casal,V3043,V3043,Renda do Casal,V3043,Renda do Casal,Y,N,HIGH,Campo numérico.
RFAMILIV,10.5,Renda familiar,V3045,V3045,Rendimento Nominal Médio Mensal Familiar,V3045,Rendimento Nominal Médio Mensal Familiar,Y,N,HIGH,Campo numérico.
RFANOMIF,10.6,Faixa renda familiar nominal,V3046,V3046,Faixas de Rendimento Nominal Médio Mensal Familiar,V3046,Faixas de Rendimento Nominal Médio Mensal Familiar,Y,N,HIGH,Categorias coincidem.
RFAPCAPF,10.7,Faixa renda per capita nominal,V3049,V3049,Faixas de Rendimento Nominal Médio Mensal Familiar Per Capita,V3049,Faixas de Rendimento Nominal Médio Mensal Familiar Per Capita,Y,N,HIGH,Categorias 1-14 coincidem (1/8 SM etc).
RFAPCAPV,10.8,Renda familiar per capita,,,,,,N,N,CANNOT_MAP,Valor numérico per capita; B/C só listam V3049 (faixa). Não há V-code para o valor per capita absoluto. Confirmado em 9 agentes.
RFAREALF,10.9,Faixa renda familiar real,V3047,V3047,Faixas de Rendimento Real Médio Mensal Familiar,V3047,Faixas de Rendimento Real Médio Mensal Familiar,Y,N,HIGH,Categorias coincidem.
APOPENS,11.1,Aposentado e/ou pensionista,V0359,V0359,Aposentado ou Pensionista,V0359,Aposentado ou Pensionista,Y,N,HIGH,Categorias 0-3 coincidem.
ATIVIDAD,11.2,Codigo da Atividade,V0347,V0347,Código da Atividade,V0347,Código da Atividade,Y,N,HIGH,Codigo de atividade.
ATIVISET,11.3,Setor de atividade,V3471,V3471,Setor de Atividade,V3471,Setor de Atividade,Y,N,HIGH,Categorias 1-11 coincidem.
CARTASS,11.4,Tem carteira trab. assinada,V0350,V0350,Posse de Carteira de Trabalho Assinada,V0350,Posse de Carteira de Trabalho Assinada,Y,N,HIGH,Categorias 1-4 coincidem.
CONPREV,11.5,Contribuinte previdencia,V0353,V0353,Contribuição para Instituto de Previdência Pública,V0353,Contribuição para Instituto de Previdência Pública,Y,N,HIGH,Categorias 1-3 coincidem.
DEFICIE,11.6,Deficiencia,V0311,V0311,Deficiência Física ou Mental,V0311,Deficiência Física ou Mental,Y,N,HIGH,Categorias 0-9 coincidem.
EDANOEST,11.7,Anos de estudo,V3241,V3241,Anos de Estudo,V3241,Anos de Estudo,Y,N,HIGH,Categorias coincidem (0=sem instr, 17=17+, 20=ND, 30=alfa adultos).
EDCURSNS,11.8,Curso nao seriado,V0326,V0326,Grau que freqüenta em curso não seriado,V0326,Grau que freqüenta em curso não seriado,Y,N,HIGH,Categorias 0-6 coincidem.
EDCURSO,11.9,Curso concluido,V0329,V0329,Curso Concluído,V0329,Curso Concluído,Y,N,HIGH,Categorias detalhadas coincidem.
EDGRAU,11.10,Grau que frequenta,V0325,V0325,Grau que freqüenta em curso seriado,V0325,Grau que freqüenta em curso seriado,Y,N,HIGH,Categorias 0-5 coincidem.
EDSABELE,11.11,Sabe ler escrever,V0323,V0323,Alfabetização,V0323,Alfabetização,Y,N,HIGH,Categorias 1-2 coincidem.
EDSERIE,11.12,Serie que frequenta,V0324,V0324,Série que freqüenta,V0324,Série que freqüenta,Y,N,HIGH,Categorias 0-8 coincidem.
EDULGRAU,11.13,Grau da ultima serie,V0328,V0328,Grau da última série concluída com aprovação,V0328,Grau da última série concluída com aprovação,Y,N,HIGH,Categorias 0-8 coincidem.
EDULSERI,11.14,Ultima serie concluida,V0327,V0327,Última série concluída com aprovação,V0327,Última série concluída com aprovação,Y,N,HIGH,Categorias 0-9 coincidem.
EMPESTB,11.15,Num. empregados estabelecimento,V0351,V0351,"Número de Empregados no Estabelecimento, Negócio, Instituição, etc.",V0351,"Número de Empregados no Estabelecimento, Negócio, Instituição, etc.",Y,N,HIGH,Categorias 1-8 coincidem.
FLDOMICH,11.16,Filhos moram domicilio - homem,V0335,V0335,Filhos Tidos que moram no domicílio,V0335,Filhos Tidos que moram no domicílio,Y,N,HIGH,Decisão final: V0335. Ver auditoria; B descreve V0335 como total dos filhos e V0337 como filhos em outro domicílio. A descrição 'Filhos moram domicilio' alinha com V0335.
FLDOMICM,11.17,Filhas moram domicilio -mulher,V0336,V0336,Filhas Tidas que moram no domicílio,V0336,Filhas Tidas que moram no domicílio,Y,N,HIGH,Análogo a FLDOMICH; V0336.
FLMORTOH,11.18,Filhos mortos - homem,V0339,V0339,Filhos Tidos Nascidos Vivos que já morreram (Homens),V0339,Filhos Tidos Nascidos Vivos que já morreram (Homens),Y,N,HIGH,Match exato.
FLMORTOM,11.19,Filhas mortas - mulher,V0340,V0340,Filhas Tidas Nascidas Vivas que já morreram (Mulheres),V0340,Filhas Tidas Nascidas Vivas que já morreram (Mulheres),Y,N,HIGH,Match exato.
FLNAMORH,11.20,Filhos nascidos mortos - homem,V0341,V0341,Filhos Tidos Nascidos Mortos (Homens),V0341,Filhos Tidos Nascidos Mortos (Homens),Y,N,HIGH,Match exato.
FLNAMORM,11.21,Filhas nascidas mortas - mulher,V0342,V0342,Filhas Tidas Nascidas Mortas (Mulheres),V0342,Filhas Tidas Nascidas Mortas (Mulheres),Y,N,HIGH,Match exato.
FLNAMORT,11.22,Total filhos nascidos mortos,V3357,V3357,Total de Filhos(as) Tidos(as) Nascidos(as) Mortos(as),V3357,Total de Filhos(as) Tidos(as) Nascidos(as) Mortos(as),N,N,MED,V3357 não está em v050; semanticamente correto. Mapping de B+C.
FLNAODOH,11.23,Filhos nao moram domicilio,V0337,V0337,Filhos Tidos que moram em outro domicílio (Homens),V0337,Filhos Tidos que moram em outro domicílio (Homens),Y,N,HIGH,Match exato.
FLNAODOM,11.24,Filhas nao moram domicilio,V0338,V0338,Filhas Tidas que moram em outro domicílio (Mulheres),V0338,Filhas Tidas que moram em outro domicílio (Mulheres),Y,N,HIGH,Match exato.
FLNAVIVH,11.25,Filhos nascidos vivos - homem,V3355,V3355,Número de Filhos Tidos Nascidos Vivos(Homens),V3355,Número de Filhos Tidos Nascidos Vivos(Homens),N,N,MED,V3355 não em v050 mas semanticamente correto.
FLNAVIVM,11.26,Filhas nascidas vivas - mulher,V3356,V3356,Número de Filhas Tidas Nascidas Vivas (Mulheres),V3356,Número de Filhas Tidas Nascidas Vivas (Mulheres),N,N,MED,V3356 não em v050.
FLNAVIVT,11.27,Total filhos nascidos vivos,V3354,V3354,Total de Filhos(as) Tidos(as) Nascidos(as) Vivos(as),V3354,Total de Filhos(as) Tidos(as) Nascidos(as) Vivos(as),N,N,MED,V3354 não em v050.
FLTIDOSH,11.28,Filhos tidos - homem,V3352,V3352,Número de Filhos Tidos (Homens),V3352,Número de Filhos Tidos (Homens),N,N,MED,V3352 não em v050.
FLTIDOSM,11.29,Filhas tidas - mulher,V3353,V3353,Número de Filhos Tidos (Mulheres),V3353,Número de Filhos Tidos (Mulheres),N,N,MED,V3353 não em v050.
FLTIDOST,11.30,Total filhos tidos,V3351,V3351,Total de Filhos(as) Tidos(as),V3351,Total de Filhos(as) Tidos(as),Y,N,HIGH,V3351 está em v050 (linha 127).
FLVIVOSH,11.31,Filhos vivos - homem,V3361,V3361,Número de Filhos Vivos (Homens),V3361,Número de Filhos Vivos (Homens),Y,N,HIGH,V3361 está em v050.
FLVIVOSM,11.32,Filhas vivas - mulher,V3362,V3362,Número de Filhas Vivas (Mulheres),V3362,Número de Filhas Vivas (Mulheres),Y,N,HIGH,V3362 está em v050.
FLVIVOST,11.33,Total filhos vivos,V3360,V3360,Total de Filhos(as) Vivos(as),V3360,Total de Filhos(as) Vivos(as),Y,N,HIGH,V3360 está em v050.
HOROUTR,11.34,Horas trabalhadas em outras ocupacões,V0355,V0355,Horas Trabalhadas em Outras Ocupações,V0355,Horas Trabalhadas em Outras Ocupações,Y,N,HIGH,3 sources agree.
HORTRAB,11.35,Horas trabalhadas ocupacao Q346,V0354,V0354,Horas Trabalhadas por Semana na Ocupação Principal,V0354,Horas Trabalhadas por Semana na Ocupação Principal,Y,N,HIGH,Q346 = ocupação principal (V0346).
IDADEANO,11.36,Idade em anos,V3072,V3072,Idade (em anos completos),V3072,Idade (em anos completos),Y,N,HIGH,3 sources agree.
IDADEMES,11.37,Idade em meses,V3073,V3073,Idade (em meses completos),V3073,Idade (em meses completos),Y,N,HIGH,Categorias coincidem (0=menos 1 mes).
IDADETIP,11.38,Tipo de idade,V3071,V3071,Tipo de Idade,V3071,Tipo de Idade,Y,N,HIGH,Categorias 1-2 coincidem.
LOCTRAB,11.39,Local de trabalho,V0352,V0352,Local de Trabalho,V0352,Local de Trabalho,Y,N,HIGH,Categorias 1-8 coincidem.
MIANMOMU,11.40,Anos que mora no municipio,V0318,V0318,Anos em que mora no Município,V0318,Anos em que mora no Município,Y,N,HIGH,3 sources agree.
MIANMOUF,11.41,Anos que mora na UF,V0317,V0317,Anos em que mora na Unidade da Federação,V0317,Anos em que mora na Unidade da Federação,Y,N,HIGH,3 sources agree.
MIANORES,11.42,Ano fixou residencia,V3152,V3152,Ano que fixou residência no País,V3152,Ano que fixou residência no País,Y,N,HIGH,3 sources agree.
MIANTEMU,11.43,Municipio moradia anterior,V3191,V3191,Município ou País Estrangeiro em que morava em 01/09/1986 (declarado no quesito 319),V3191,Município ou País Estrangeiro em que morava em 01/09/1986 (declarado no quesito 319),Y,N,MED,V3191 é o codigo municipal/pais para a moradia anterior (quesito 319). A descrição 'Municipio moradia anterior' alinha com V3191.
MIANTEUF,11.44,Lugar de moradia anterior,V0319,V0319,Unidade da Federação e Município ou País Estrangeiro que morava antes,V0319,Unidade da Federação e Município ou País Estrangeiro que morava antes,Y,N,HIGH,Categorias UF coincidem.
MIANTEZN,11.45,Zona moradia anterior,V0320,V0320,Situação do Domicílio de Residência Anterior (declarado no quesito 319),V0320,Situação do Domicílio de Residência Anterior (declarado no quesito 319),Y,N,HIGH,Categorias 1=Urbana 2=Rural 9=Ignorado coincidem.
MIMO86MU,11.46,Municipio moradia em 86,V3211,V3211,Município ou País Estrangeiro de residência em 01/09/1986 (declarado no quesito 321),V3211,Município ou País Estrangeiro de residência em 01/09/1986 (declarado no quesito 321),Y,N,HIGH,V3211 é o codigo municipio/pais combinado com V0321.
MIMO86UF,11.47,Lugar de moradia em 01/09/86,V0321,V0321,Unidade da Federação e Município ou País Estrangeiro em que morava em 01/09/1986,V0321,Unidade da Federação e Município ou País Estrangeiro em que morava em 01/09/1986,Y,N,HIGH,Categorias UF + 70=Neste municipio coincidem.
MIMO86ZN,11.48,Zona de moradia em 86,V0322,V0322,Situação do Domicílio de Residência em 01/09/86 (declarado no quesito 321),V0322,Situação do Domicílio de Residência em 01/09/86 (declarado no quesito 321),Y,N,HIGH,Categorias 1-2-9 coincidem.
MIMUMOZN,11.49,Zona que morou neste municipio,V0312,V0312,Morou neste Município,V0312,Morou neste Município,Y,N,HIGH,Categorias 1=Só urbana 2=Só rural 3=Urbana e rural coincidem.
MINACION,11.50,Nacionalidade,V3151,V3151,Nacionalidade,V3151,Nacionalidade,Y,N,HIGH,Categorias 1-3 coincidem.
MINASCMU,11.51,Nasceu neste municipio,V0314,V0314,Nasceu neste Município,V0314,Nasceu neste Município,Y,N,HIGH,Categorias 1-3 coincidem.
MIUFPAIS,11.52,UF/Pais de nascimento,V0316,V0316,Unidade da Federação ou País Estrangeiro de Nascimento,V0316,Unidade da Federação ou País Estrangeiro de Nascimento,Y,N,HIGH,Categorias UF+países coincidem.
MIULTMUD,11.53,Ultima mudanca,V0313,V0313,Anos de Moradia na Situação do Domicílio,V0313,Anos de Moradia na Situação do Domicílio,Y,N,HIGH,Categorias 0=menos 1 ano 98=Nunca mudou coincidem.
NORDMAE,11.54,Numero de ordem da mae,V3005,V3005,Número de Ordem da Mãe,V3005,Número de Ordem da Mãe,Y,N,HIGH,Categorias 70=viva nao reside 80=falecida 90=Nao sabe 99=Ignorado coincidem.
OCUPACAO,11.55,Ocupacao principal,V0346,V0346,Código da Ocupação,V0346,Código da Ocupação,Y,N,HIGH,Codigo de ocupação.
OCUPAGRP,11.56,Grupo ocupacao principal,V3461,V3461,Grupo de Ocupação,V3461,Grupo de Ocupação,Y,N,HIGH,Categorias 1-10 coincidem.
PARENDOM,11.57,Parentesco com o do chefe domicilio,V0302,V0302,Condição no Domicílio,V0302,Condição no Domicílio,Y,N,HIGH,Categorias 1-16+20 coincidem.
PARENFAM,11.58,Parentesco com o chefe da familia,V0303,V0303,Condição na Família,V0303,Condição na Família,Y,N,HIGH,Categorias 1-15+20 coincidem.
PESSOAN,11.59,Numero de ordem,V0098,V0098,Ordem da Pessoa,V0098,Ordem da Pessoa,Y,Y,HIGH,3 sources agree.
POSOCUP,11.60,Posicao da ocupacao,V0349,V0349,Posição na Ocupação,V0349,Posição na Ocupação,Y,N,HIGH,Categorias 1-11 coincidem.
RACACOR,11.61,Raca ou cor,V0309,V0309,Raça ou Cor,V0309,Raça ou Cor,Y,N,HIGH,Categorias 1-5+9 coincidem.
RAPOSENF,11.62,Faixa de rend aposent/pensionista,V3604,V3604,Faixas de Rendimento de Aposentadoria e/ou Pensão,V3604,Faixas de Rendimento de Aposentadoria e/ou Pensão,Y,N,HIGH,Categorias coincidem.
RAPOSENV,11.63,Valor rend aposent/pensionista,V0360,V0360,Rendimento Bruto de Aposentadoria e/ou Pensão,V0360,Rendimento Bruto de Aposentadoria e/ou Pensão,Y,N,HIGH,Campo numérico.
RELIGIAO,11.64,Codigo da religiao,V0310,V0310,Religião,V0310,Religião,Y,N,HIGH,Categorias detalhadas coincidem.
ROUTOCUF,11.65,Faixa renda outras ocupacoes,V3574,V3574,Faixas de Rendimento de Outras Ocupações,V3574,Faixas de Rendimento de Outras Ocupações,Y,N,HIGH,Categorias coincidem.
ROUTOCUV,11.66,Rend bruto outras ocupacoes,V0357,V0357,Rendimento Bruto de Outras Ocupações,V0357,Rendimento Bruto de Outras Ocupações,Y,N,HIGH,Campo numérico.
ROUTRENF,11.67,Faixa outros rendimentos,V3614,V3614,Faixas de Outros Rendimentos,V3614,Faixas de Outros Rendimentos,Y,N,HIGH,Categorias coincidem.
ROUTRENV,11.68,Valor outros rendimentos,V0361,V0361,Rendimento Bruto ou Média Mensal de Outros Rendimentos,V0361,Rendimento Bruto ou Média Mensal de Outros Rendimentos,Y,N,HIGH,Campo numérico.
RPRINCIF,11.69,Faixa renda ocupação principal,V3564,V3564,Faixas de Rendimento da Ocupação Principal,V3564,Faixas de Rendimento da Ocupação Principal,Y,N,HIGH,Categorias coincidem.
RPRINCIV,11.70,Rendimento bruto ocupacao principal,V0356,V0356,Rendimento Bruto da Ocupação Principal,V0356,Rendimento Bruto da Ocupação Principal,Y,N,HIGH,Campo numérico.
RTONOMIF,11.71,Faixa renda total nominal,V3562,V3562,Faixas de Rendimento Nominal Total,V3562,Faixas de Rendimento Nominal Total,Y,N,HIGH,Categorias coincidem.
RTOREALF,11.72,Faixa renda real pessoal,V3563,V3563,Faixas de Rendimento Real Total,V3563,Faixas de Rendimento Real Total,Y,N,HIGH,Categorias coincidem.
RTOTALPV,11.73,Renda total,V3561,V3561,Rendimento Nominal Total,V3561,Rendimento Nominal Total,Y,N,HIGH,Campo numérico.
SCATUAL,11.74,Situacao conjugal atual,V3342,V3342,Situação Conjugal Atual da Pessoa,V3342,Situação Conjugal Atual da Pessoa,Y,N,HIGH,Categorias 1-5 coincidem.
SCDURASC,11.75,Duracao sit. conjugal atual,V3341,V3341,Duração da Situação Conjugal Atual da Pessoa,V3341,Duração da Situação Conjugal Atual da Pessoa,Y,N,HIGH,Campo numérico.
SCID1UNI,11.76,Idade ao contrair 1ªuniao,V3311,V3311,Idade da Pessoa ao contrair a Primeira União,V3311,Idade da Pessoa ao contrair a Primeira União,Y,N,HIGH,3 sources agree.
SCIDISCA,11.77,Idade inicio sit.conj.atual,V3312,V3312,Idade da Pessoa ao iniciar a Situação Conjugal Atual,V3312,Idade da Pessoa ao iniciar a Situação Conjugal Atual,Y,N,HIGH,3 sources agree.
SCNAOUNI,11.78,Nao vive com conjuge,V0333,V0333,Estado Conjugal (Situação Conjugal),V0333,Estado Conjugal (Situação Conjugal),Y,N,HIGH,Categorias 5-9 coincidem (separado/desquitado/divorciado/viuvo).
SCNATUNI,11.79,Natureza da uniao,V0332,V0332,Estado Conjugal (Natureza da União),V0332,Estado Conjugal (Natureza da União),Y,N,HIGH,Categorias 1-4+9 coincidem.
SCVIVCON,11.80,Vive ou viveu com conjuge,V0330,V0330,Vive ou Viveu com Cônjuge,V0330,Vive ou Viveu com Cônjuge,Y,N,HIGH,Categorias 1-2 coincidem.
SEXO,11.81,Sexo,V0301,V0301,Sexo,V0301,Sexo,Y,N,HIGH,Categorias 1-2 coincidem.
SITDESO,11.82,Situacao desocupado,V0358,V0358,Condição de Atividade,V0358,Condição de Atividade,Y,N,HIGH,Categorias 0-9 coincidem.
TRUL12M,11.83,Trabalhou ultimos 12 meses,V0345,V0345,Trabalhou em todos ou em parte dos últimos 12 meses,V0345,Trabalhou em todos ou em parte dos últimos 12 meses,Y,N,HIGH,Categorias 1-3 coincidem.
UVIVIDAD,11.84,Idade calculada do ult.filho nasc.vivo,V3443,V3443,Idade Calculada do(a) Último(a) Filho(a) Nascido(a) Vivo(a),V3443,Idade Calculada do(a) Último(a) Filho(a) Nascido(a) Vivo(a),Y,N,HIGH,3 sources agree.
UVIVIDTP,11.85,Tipo idade ult.filho nasc vivo,V3444,V3444,Tipo de Idade do(a) Último(a) Filho(a) Nascido(a) Vivo(a),V3444,Tipo de Idade do(a) Último(a) Filho(a) Nascido(a) Vivo(a),Y,N,HIGH,Categorias 1-2-9 coincidem.
UVIVSEXO,11.86,Sexo ultimo filho nascido vivo,V0343,V0343,Sexo do Último Filho Nascido Vivo,V0343,Sexo do Último Filho Nascido Vivo,Y,N,HIGH,Categorias 1-2-7-9 coincidem.
